{
  "case_count": 18,
  "created_at": 1780242707.0,
  "failure_count": 10,
  "files": [
    {
      "bytes": 7705,
      "path": "predictions.jsonl",
      "role": "predictions",
      "sha256": "e6ccdf33f7104b261ac52005881786cdbb25496a695410724e3a7001328261ce"
    },
    {
      "bytes": 51186,
      "path": "report.json",
      "role": "report",
      "sha256": "9028699a80c286fb644d9a7212209d452c5e5e0cbc8303c06599fb4950017c83"
    },
    {
      "bytes": 2021,
      "path": "result_card.json",
      "role": "result_card",
      "sha256": "e726577943559f5fcbef4eae2b1124664651af556f8e7fcb57e1413cfe4cd67c"
    },
    {
      "bytes": 1043,
      "path": "submission.json",
      "role": "submission",
      "sha256": "16dcd97f63498051f2aa7cecdb2362379b8f8e9cce5f6bf5d754f54d42780b4f"
    },
    {
      "bytes": 1449,
      "path": "submission_bundle.json",
      "role": "submission_bundle",
      "sha256": "ad4e2ff41796e55d2577fd6d056cae589e952c2d023ac1422186af146a72162a"
    },
    {
      "bytes": 3314,
      "path": "submission_review.json",
      "role": "submission_review",
      "sha256": "ecbe2aa60d0f00d428b04046900379f35fe8fecf49cfc57f39f67986c539a3d7"
    }
  ],
  "notes": "Checked example publication packet for the current public release.",
  "overall_score": 11.11,
  "ready_for_publication": true,
  "release_id": "marked-bench-contradiction-standard-release-0.4.10",
  "report_sha256": "9028699a80c286fb644d9a7212209d452c5e5e0cbc8303c06599fb4950017c83",
  "result_card_sha256": "e726577943559f5fcbef4eae2b1124664651af556f8e7fcb57e1413cfe4cd67c",
  "schema": "marked_bench.publication-packet.v1",
  "standard_claims": {
    "not_safety_certification": true,
    "report_validator_required": true,
    "result_card_required": true,
    "same_suite_hash_required": true,
    "self_contained_public_result_packet": true,
    "submission_bundle_required": true
  },
  "submitter": "The Marked Bench Examples",
  "suite_hash": "07a2bb9c0e8356d1cdab98b5b1b35a3c8bd29beff695816dfb151dbb5f6d0d1f",
  "suite_id": "marked-bench-contradiction-multihop",
  "suite_version": "0.3.0",
  "system_name": "ExampleExternalJsonl",
  "system_version": "demo-1.0",
  "validations": {
    "report": {
      "error_count": 0,
      "schema": "marked_bench.contradiction-benchmark-validation.v1",
      "valid": true,
      "warning_count": 0
    },
    "result_card": {
      "error_count": 0,
      "schema": "marked_bench.result-card-validation.v1",
      "valid": true,
      "warning_count": 0
    },
    "submission": {
      "error_count": 0,
      "schema": "marked_bench.leaderboard-submission-validation.v1",
      "valid": true,
      "warning_count": 0
    },
    "submission_bundle": {
      "error_count": 0,
      "schema": "marked_bench.leaderboard-submission-bundle-validation.v1",
      "valid": true,
      "warning_count": 0
    },
    "submission_review": {
      "error_count": 0,
      "schema": "marked_bench.submission-review-validation.v1",
      "valid": true,
      "warning_count": 0
    }
  }
}